{
    "_id": "TCGA:2018-04-05_ALL_A_TPR_2020plus",
    "_schema": "https://www.elixir-europe.org/excelerate/WP2/json-schemas/1.0/Dataset",
    "challenge_ids": [
        "TCGA:2018-04-05_ALL"
    ],
    "community_ids": [
        "OEBC001"
    ],
    "datalink": {
        "inline_data": {
            "value": 0.6254180602006689
        }
    },
    "dataset_contact_ids": [
        "Collin.Tokheim"
    ],
    "dates": {
        "creation": "2018-04-05T00:00:00Z",
        "modification": "2018-04-05T14:00:00Z"
    },
    "depends_on": {
        "metrics_id": "TCGA:TPR",
        "rel_dataset_ids": [
            {
                "dataset_id": "TCGA:2018-04-05_ALL_P_2020plus"
            },
            {
                "dataset_id": "TCGA:2018-04-05_ALL_M"
            }
        ],
        "tool_id": "TCGA:2020plus"
    },
    "description": "Assessment dataset for applying Metric 'True Positive Rate' to 2020plus predictions in All cancer types",
    "name": "Assesment of Metric TPR in 2020plus",
    "type": "assessment",
    "version": "1",
    "visibility": "public"
}