{
    "_id": "QfO:2011-07-07_G_STD_Fungi_A_STD_comp_trees_OrthoFinder-2.0-BLAST",
    "_schema": "https://www.elixir-europe.org/excelerate/WP2/json-schemas/1.0/Dataset",
    "challenge_ids": [
        "QfO:2011-07-07_G_STD_Fungi"
    ],
    "community_ids": [
        "OEBC002"
    ],
    "datalink": {
        "inline_data": {
            "error": 0,
            "value": 20207.0
        }
    },
    "dataset_contact_ids": [
        "Christophe.Dessimoz",
        "Paul.Thomas",
        "Toni.Gabaldon",
        "Erik.Sonnhammer"
    ],
    "dates": {
        "creation": "2011-07-07T00:00:00Z",
        "modification": "2011-07-07T14:00:00Z"
    },
    "depends_on": {
        "metrics_id": "QfO:STD_comp_trees",
        "rel_dataset_ids": [
            {
                "dataset_id": "QfO:2011-07-07_P_OrthoFinder-2.0-BLAST"
            },
            {
                "dataset_id": "QfO:2011-07-07_G_STD_Fungi_M"
            }
        ],
        "tool_id": "QfO:OrthoFinder-2.0-BLAST"
    },
    "description": "Assessment dataset for applying Metric 'STD_comp_trees' to OrthoFinder-2.0-BLAST predictions in Generalized Species Tree Discordance in Fungi",
    "name": "Assesment of STD_comp_trees in OrthoFinder-2.0-BLAST",
    "type": "assessment",
    "version": "1",
    "visibility": "public"
}