{
    "_id": "QfO:2011-07-07_G_STD_Fungi_A_STD_incorrect_trees_OMA-Pairs-2.0",
    "_schema": "https://www.elixir-europe.org/excelerate/WP2/json-schemas/1.0/Dataset",
    "challenge_ids": [
        "QfO:2011-07-07_G_STD_Fungi"
    ],
    "community_ids": [
        "OEBC002"
    ],
    "datalink": {
        "inline_data": {
            "error": "0.008678",
            "value": "0.062667"
        }
    },
    "dataset_contact_ids": [
        "Christophe.Dessimoz",
        "Paul.Thomas",
        "Toni.Gabaldon",
        "Erik.Sonnhammer"
    ],
    "dates": {
        "creation": "2011-07-07T00:00:00Z",
        "modification": "2011-07-07T14:00:00Z"
    },
    "depends_on": {
        "metrics_id": "QfO:STD_incorrect_trees",
        "rel_dataset_ids": [
            {
                "dataset_id": "QfO:2011-07-07_P_OMA-Pairs-2.0"
            },
            {
                "dataset_id": "QfO:2011-07-07_G_STD_Fungi_M"
            }
        ],
        "tool_id": "QfO:OMA-Pairs-2.0"
    },
    "description": "Assessment dataset for applying Metric 'STD_incorrect_trees' to OMA-Pairs-2.0 predictions in Generalized Species Tree Discordance in Fungi",
    "name": "Assesment of STD_incorrect_trees in OMA-Pairs-2.0",
    "type": "assessment",
    "version": "1",
    "visibility": "public"
}