{
    "_id": "QfO:2011-07-07_SwissTree_A_SwissTree_TPR_InParanoidCore",
    "_schema": "https://www.elixir-europe.org/excelerate/WP2/json-schemas/1.0/Dataset",
    "challenge_ids": [
        "QfO:2011-07-07_SwissTree"
    ],
    "community_ids": [
        "OEBC002"
    ],
    "datalink": {
        "inline_data": {
            "error": "0.065164",
            "value": "0.884322"
        }
    },
    "dataset_contact_ids": [
        "Christophe.Dessimoz",
        "Paul.Thomas",
        "Toni.Gabaldon",
        "Erik.Sonnhammer"
    ],
    "dates": {
        "creation": "2011-07-07T00:00:00Z",
        "modification": "2011-07-07T14:00:00Z"
    },
    "depends_on": {
        "metrics_id": "QfO:SwissTree_TPR",
        "rel_dataset_ids": [
            {
                "dataset_id": "QfO:2011-07-07_P_InParanoidCore"
            },
            {
                "dataset_id": "QfO:2011-07-07_SwissTree_M"
            }
        ],
        "tool_id": "QfO:InParanoidCore"
    },
    "description": "Assessment dataset for applying Metric 'SwissTree_TPR' to InParanoidCore predictions in Agreement with Reference Gene Phylogenies: SwissTree",
    "name": "Assesment of SwissTree_TPR in InParanoidCore",
    "type": "assessment",
    "version": "1",
    "visibility": "public"
}