{
    "_id": "QfO:2011-07-07_G_STD_LUCA_A_STD_num_orthologs_EggNOG",
    "_schema": "https://www.elixir-europe.org/excelerate/WP2/json-schemas/1.0/Dataset",
    "challenge_ids": [
        "QfO:2011-07-07_G_STD_LUCA"
    ],
    "community_ids": [
        "OEBC002"
    ],
    "datalink": {
        "inline_data": {
            "error": 0,
            "value": 4572074.0
        }
    },
    "dataset_contact_ids": [
        "Christophe.Dessimoz",
        "Paul.Thomas",
        "Toni.Gabaldon",
        "Erik.Sonnhammer"
    ],
    "dates": {
        "creation": "2011-07-07T00:00:00Z",
        "modification": "2011-07-07T14:00:00Z"
    },
    "depends_on": {
        "metrics_id": "QfO:STD_num_orthologs",
        "rel_dataset_ids": [
            {
                "dataset_id": "QfO:2011-07-07_P_EggNOG"
            },
            {
                "dataset_id": "QfO:2011-07-07_G_STD_LUCA_M"
            }
        ],
        "tool_id": "QfO:EggNOG"
    },
    "description": "Assessment dataset for applying Metric 'STD_num_orthologs' to EggNOG predictions in Generalized Species Tree Discordance in LUCA",
    "name": "Assesment of STD_num_orthologs in EggNOG",
    "type": "assessment",
    "version": "1",
    "visibility": "public"
}