{
    "_id": "TCGA:2018-04-05_CHOL_A_precision_MuSiC",
    "_schema": "https://www.elixir-europe.org/excelerate/WP2/json-schemas/1.0/Dataset",
    "challenge_ids": [
        "TCGA:2018-04-05_CHOL"
    ],
    "community_ids": [
        "OEBC001"
    ],
    "datalink": {
        "inline_data": {
            "value": 1.0
        }
    },
    "dataset_contact_ids": [
        "Nathan.Dees"
    ],
    "dates": {
        "creation": "2018-04-05T00:00:00Z",
        "modification": "2018-04-05T14:00:00Z"
    },
    "depends_on": {
        "metrics_id": "TCGA:precision",
        "rel_dataset_ids": [
            {
                "dataset_id": "TCGA:2018-04-05_CHOL_P_MuSiC"
            },
            {
                "dataset_id": "TCGA:2018-04-05_CHOL_M"
            }
        ],
        "tool_id": "TCGA:MuSiC"
    },
    "description": "Assessment dataset for applying Metric 'Positive Predictive Value' to MuSiC predictions in Cholangiocarcinoma",
    "name": "Assesment of Metric precision-PPV in MuSiC",
    "type": "assessment",
    "version": "1",
    "visibility": "public"
}